{
  "task_id": "issue-249",
  "workflow_id": "bug-fix",
  "contract_version": 2,
  "change_type": "bug-fix",
  "risk_level": "medium",
  "state": "completed",
  "rework_count": 0,
  "max_rework_attempts": 2,
  "history": [
    {
      "from": "intake",
      "to": "investigating",
      "at": "2026-09-09",
      "actor": "Developer Agent",
      "evidence_refs": [
        "failure_description",
        "repro"
      ]
    },
    {
      "from": "investigating",
      "to": "implementing",
      "at": "2026-09-09",
      "actor": "Developer Agent",
      "evidence_refs": [
        "fail_path",
        "hypothesis_matrix"
      ]
    },
    {
      "from": "implementing",
      "to": "verifying",
      "at": "2026-09-09",
      "actor": "Developer Agent",
      "evidence_refs": [
        "changed_files",
        "validation_plan"
      ]
    },
    {
      "from": "verifying",
      "to": "handoff",
      "at": "2026-09-30T15:23:02.377Z",
      "actor": "qa-agent",
      "evidence_refs": [
        "original_repro_result",
        "verification_result",
        "test_evidence",
        "qa_report_ref",
        "qa_evidence_url",
        "pr_merge_sha"
      ]
    },
    {
      "from": "handoff",
      "to": "completed",
      "at": "2026-09-30T16:00:08.900Z",
      "actor": "orchestrator",
      "evidence_refs": [
        "closeout_evidence"
      ]
    }
  ],
  "evidence": {
    "failure_description": "Issue #249: raw text flag extraction hijacked by quoted title",
    "repro": "test/validate-pr-readiness.test.mjs: Issue #249 shapes 9–13 (all RED on baseline)",
    "fail_path": "Raw regex in extractBodyFromCommand ignores quoted argument boundaries",
    "hypothesis_matrix": "Direct extractor proof in docs/records/qa/2026-09-09-issue-249-token-body-code-review.md",
    "changed_files": [
      "scripts/validate-pr-readiness.mjs",
      "test/validate-pr-readiness.test.mjs",
      "README.md"
    ],
    "validation_plan": "docs/records/work-items/issue-249/developer-plan.md",
    "original_repro_result": "Independent QA reproduced the Issue #249 baseline shapes 9–13 against pristine cd43b4a; see the QA record and issue QA comment.",
    "verification_result": "AC-01 through AC-07 PASS on origin/main 4f3210c4df444dd7f7edf8b485c4cbc450295cf4; focused readiness suite 121 passed, 0 failed; four Minor findings are non-blocking.",
    "test_evidence": "node --test test/validate-pr-readiness.test.mjs: 121 passed, 0 failed on files matching pinned origin/main.",
    "qa_report_ref": "docs/records/qa/2026-09-30-issue-249-lifecycle-reconciliation-qa.md",
    "qa_evidence_url": "https://github.com/chakrits/AI-Agent-Workflow/issues/249#issuecomment-5596393014",
    "pr_merge_sha": "0c4f79055a5f8b90153fee9ede1cefc9335950a4",
    "closeout_evidence": "Issue #249 closed; PR #251 merged as 0c4f79055a5f8b90153fee9ede1cefc9335950a4; QA AC-01..07 PASS recorded in docs/records/qa/2026-09-30-issue-249-lifecycle-reconciliation-qa.md (121/121 focused tests; QA comment 5596393014)."
  },
  "next_route": "completed",
  "stop_reason": null,
  "policy_contract_version": 1,
  "sequence_number": 6,
  "state_digest": "4b8de57a90d47946097c1e9f9335ea5461966b1e6f79f28b72eb9bf6c03bb6c1"
}
